author,content,date,image,image_content,tag,title,url
Redacción,,"Miércoles, 14 de Abril de 2021",https://noticiasdelaciencia.com/upload/images/04_2021/525_diferencias-entre-el-cerebro-de-la-mujer-y-el-del-hombre.jpg,"En el nuevo análisis de resultados de investigaciones, estos han sido comparados entre sí en busca de pautas consistentes. (Imagen: Amazings / NCYT)",Neurología,Diferencias entre el cerebro de la mujer y el del hombre,https://noticiasdelaciencia.com/art/41495/diferencias-entre-el-cerebro-de-la-mujer-y-el-del-hombre
Redacción,,"Martes, 27 de Abril de 2021",https://noticiasdelaciencia.com/upload/images/04_2021/6353_puede-realmente-el-cerebro-del-recien-nacido.jpg,El nuevo estudio muestra que los recién nacidos no distinguen completamente distintos sonidos vocálicos. (Foto: Teresa Ribas-Prats),Neurología,¿Puede realmente el cerebro del recién nacido discriminar todos los sonidos del habla?,https://noticiasdelaciencia.com/art/41607/puede-realmente-el-cerebro-del-recien-nacido-discriminar-todos-los-sonidos-del-habla
Redacción,,"Miércoles, 21 de Abril de 2021",,,Educación,"Los niños aprenden más rápido los idiomas extranjeros, ¿mito o realidad?",https://noticiasdelaciencia.com/art/41557/los-ninos-aprenden-mas-rapido-los-idiomas-extranjeros-mito-o-realidad
Redacción,,"Viernes, 30 de Abril de 2021",https://noticiasdelaciencia.com/upload/images/04_2021/4447_no-pensar-en-nada-para-luego-poder-concentrarse-mejor.jpg,Alfonso Barrós-Loscertales. (Foto: Damián Llorens / UJI),Psicología,No pensar en nada para luego poder concentrarse mejor,https://noticiasdelaciencia.com/art/41643/no-pensar-en-nada-para-luego-poder-concentrarse-mejor
Redacción,,"Lunes, 05 de Abril de 2021",https://noticiasdelaciencia.com/upload/images/04_2021/2934_dispersion-de-larvas-de-peces-en-el-mediterraneo-occidental.jpg,"El estudio ayudará a determinar áreas marinas protegidas que deben garantizar la conectividad para las poblaciones de peces de cada área. (Foto: Enrique Ballesteros, CEAB-CSIC)",Ecología,Dispersión de larvas de peces en el Mediterráneo occidental,https://noticiasdelaciencia.com/art/41425/dispersion-de-larvas-de-peces-en-el-mediterraneo-occidental
Redacción,,"Miércoles, 07 de Abril de 2021",https://noticiasdelaciencia.com/upload/images/04_2021/7577_el-artico-blanco-y-el-artico-verde.jpg,Sarah Crump y un colaborador a bordo de una barca navegando por un lago en la isla de Baffin. (Foto: Zach Montes / Orijin Media),Climatología,El Ártico blanco y el Ártico verde,https://noticiasdelaciencia.com/art/41438/el-artico-blanco-y-el-artico-verde
Redacción,,"Lunes, 12 de Abril de 2021",https://noticiasdelaciencia.com/upload/images/04_2021/1697_el-cambio-climatico-global-puede-desestabilizar-el-almacenamiento.jpg,"El nuevo estudio demuestra que el cambio climático global puede desestabilizar el almacenamiento mundial de carbono del suelo. En la imagen, el río Narayani en el Himalaya. Se trata de un afluente del río Ganges, investigado en el estudio. (Foto: © Valier Galy / Woods Hole Oceanographic Institution)",Climatología,¿El cambio climático global puede desestabilizar el almacenamiento de dióxido de carbono en toda clase de suelos?,https://noticiasdelaciencia.com/art/41471/el-cambio-climatico-global-puede-desestabilizar-el-almacenamiento-de-dioxido-de-carbono-en-toda-clase-de-suelos
Redacción,,"Viernes, 16 de Abril de 2021",https://noticiasdelaciencia.com/upload/images/04_2021/5971_pedido-4559.jpg,,Sociedad,La mejor manera de renovar tu casa,https://noticiasdelaciencia.com/art/41515/la-mejor-manera-de-renovar-tu-casa
Redacción,,"Viernes, 16 de Abril de 2021",https://noticiasdelaciencia.com/upload/images/04_2021/8316_contribucion-de-la-perdida-de-masa-de-los-glaciares.jpg,"Resumen gráfico de los mecanismos típicos de pérdida de masa en el frente de un glaciar con terminación en mar no flotante. En el caso de una lengua de glaciar flotante o una plataforma de hielo, también habría fusión submarina bajo la lengua o plataforma. La ablación frontal incluye el desprendimiento de icebergs y la fusión frontal submarina y subaérea. La ablación superficial incluye la fusión en superficie (y la consiguiente escorrentía) y la sublimación. (Imagen: Javier Lapazarán / UPM)",Glaciología,Contribución de la pérdida de masa de los glaciares al aumento del nivel del mar,https://noticiasdelaciencia.com/art/41527/contribucion-de-la-perdida-de-masa-de-los-glaciares-al-aumento-del-nivel-del-mar
Redacción,,"Viernes, 23 de Abril de 2021",https://noticiasdelaciencia.com/upload/images/04_2021/6614_cuando-llueve-por-vez-primera-en-siglos.jpg,(Foto: Carlos González Silva),Ciencia en imágenes,Cuando llueve por vez primera en siglos,https://noticiasdelaciencia.com/art/41579/cuando-llueve-por-vez-primera-en-siglos
Redacción,,"Miércoles, 21 de Abril de 2021",https://noticiasdelaciencia.com/upload/images/04_2021/9381_el-cafe-de-colombia-y-el-cambio-climatico-global.jpg,"Federico Ceballos-Sierra inspeccionando plantas de café en el cafetal de su familia en Colombia. (Foto: College of AC ES, University of Illinois)",Agricultura,El café de Colombia y el cambio climático global,https://noticiasdelaciencia.com/art/41556/el-cafe-de-colombia-y-el-cambio-climatico-global
Redacción,,"Viernes, 30 de Abril de 2021",https://noticiasdelaciencia.com/upload/images/04_2021/4600_gases-de-efecto-invernadero-retenidos-durante-400-000-anos.jpg,"Los investigadores analizaron permafrost de cuevas en lugares del oeste de Canadá y encontraron pruebas de que, hace entre 1,5 millones y 400.000 años, el permafrost era propenso a descongelarse, incluso en las altas latitudes del Ártico, pero que en los últimos 400.000 años se ha mantenido muy estable, reteniendo carbono acumulado. (Foto: cortesía de los investigadores. ,)",Geología,Gases de efecto invernadero retenidos durante 400.000 años en el permafrost,https://noticiasdelaciencia.com/art/41635/gases-de-efecto-invernadero-retenidos-durante-400000-anos-en-el-permafrost
Redacción,,"Lunes, 26 de Abril de 2021",,,Ecología,"Los neceseres im(perfectos) de San Saru, una apuesta doble por la sostenibilidad",https://noticiasdelaciencia.com/art/41590/los-neceseres-imperfectos-de-san-saru-una-apuesta-doble-por-la-sostenibilidad
Redacción,,"Jueves, 25 de Marzo de 2021",https://noticiasdelaciencia.com/upload/images/03_2021/7907_produccion-de-fitoplancton-cambio-climatico-y-ecosistemas.jpg,"Las redes tróficas bentónicas dependen en gran medida de la materia orgánica acumulada en los fondos marinos durante los meses de verano. (Foto: Lluís Cardona / Conxita Àvila, Proyectos Distantcom y Bluebio (UB-IRBio))",Ecología,"Producción de fitoplancton, cambio climático y ecosistemas marinos antárticos",https://noticiasdelaciencia.com/art/41370/produccion-de-fitoplancton-cambio-climatico-y-ecosistemas-marinos-antarticos
Redacción,,"Viernes, 30 de Abril de 2021",https://noticiasdelaciencia.com/upload/images/04_2021/8786_los-pozos-de-agua-subterranea-en-todo-el-mundo.jpg,Un pozo en una región árida. (Foto: UC Santa Barbara),Hidrología,Los pozos de agua subterránea en todo el mundo están en riesgo de secarse,https://noticiasdelaciencia.com/art/41644/los-pozos-de-agua-subterranea-en-todo-el-mundo-estan-en-riesgo-de-secarse
Redacción,,"Lunes, 29 de Marzo de 2021",https://noticiasdelaciencia.com/upload/images/03_2021/1829_los-oceanos-estan-mas-amenazados-que-nunca.jpg,Los arrecifes de coral en las Fidji están amenazados por el calentamiento y el aumento de acidez del agua marina. (Imagen: Coral Reef Image Bank / Jayne Jenk),Climatología,"Los océanos están más amenazados que nunca, advierte la Organización Meteorológica Mundial",https://noticiasdelaciencia.com/art/41393/los-oceanos-estan-mas-amenazados-que-nunca-advierte-la-organizacion-meteorologica-mundial
Redacción,,"Martes, 06 de Abril de 2021",https://noticiasdelaciencia.com/upload/images/04_2021/3548_la-influencia-directa-de-la-temperatura-en-la-eficiencia.jpg,"El aumento de las temperaturas asociado al cambio climático global afecta a la capacidad de las plantas para mantener su integridad estructural, absorber dióxido de carbono, retener agua y crecer y reproducirse. (Imagen: Julie McMahon)",Ecología,La influencia directa de la temperatura en la eficiencia de la fotosíntesis,https://noticiasdelaciencia.com/art/41433/la-influencia-directa-de-la-temperatura-en-la-eficiencia-de-la-fotosintesis
Redacción,,"Miércoles, 31 de Marzo de 2021",https://noticiasdelaciencia.com/upload/images/03_2021/8118_son-normales-las-recientes-sequias-veraniegas-en-europa.jpg,Ejemplo de bloque de tronco de roble en el que pueden apreciarse anillos de crecimiento anual. (Foto: Ulf Büntgen),Climatología,¿Son normales las recientes sequías veraniegas en Europa?,https://noticiasdelaciencia.com/art/41420/son-normales-las-recientes-sequias-veraniegas-en-europa
Redacción,,"Miércoles, 07 de Abril de 2021",https://noticiasdelaciencia.com/upload/images/04_2021/6911_alteraciones-ambientales-y-cambios-en-la-resistencia-a-estas.jpg,Ejemplar de pulga de agua. (Foto: Fundación Descubre),Ecología,Alteraciones ambientales y cambios en la resistencia a estas de organismos acuáticos,https://noticiasdelaciencia.com/art/41444/alteraciones-ambientales-y-cambios-en-la-resistencia-a-estas-de-organismos-acuaticos
Redacción,,"Viernes, 16 de Abril de 2021",https://noticiasdelaciencia.com/upload/images/04_2021/9847_filtro-barato-que-usa-luz-solar-para-purificar-agua.jpg,"Un prototipo del filtro depositado en la superficie de un lago durante una de las pruebas. En esta fase de su ciclo de trabajo, está absorbiendo agua y rechazando todo lo demás. (Foto: Xiaohui Xu, Princeton University)",Ingeniería,Filtro barato que usa luz solar para purificar agua,https://noticiasdelaciencia.com/art/41520/filtro-barato-que-usa-luz-solar-para-purificar-agua
Redacción,,"Jueves, 22 de Abril de 2021",https://noticiasdelaciencia.com/upload/images/04_2021/3528_expertos-en-derechos-humanos-estan-consternados.jpg,Técnicos del Organismo Internacional para la Energía Atómica recolectan muestras de agua cerca de la dañada central nuclear de Fukushima en noviembre de 2013. (Foto: IAEA / David Osborn),Contaminación nuclear,Expertos en derechos humanos están consternados por la decisión de Japón de verter el agua tratada de Fukushima,https://noticiasdelaciencia.com/art/41570/expertos-en-derechos-humanos-estan-consternados-por-la-decision-de-japon-de-verter-el-agua-tratada-de-fukushima
Redacción,,"Domingo, 18 de Abril de 2021",https://noticiasdelaciencia.com/upload/images/04_2021/7466_humitat1.jpg,,Medio Ambiente,Solución en la eliminación de humedades gracias al sistema del Dr. Viñas,https://noticiasdelaciencia.com/art/41530/solucion-en-la-eliminacion-de-humedades-gracias-al-sistema-del-dr-vinas
Redacción,,"Jueves, 15 de Abril de 2021",https://noticiasdelaciencia.com/upload/images/04_2021/5464_lanzan-iniciativa-mundial-para-acabar-con-la-basura-marina.jpg,Pescadores en Madagascar. (Foto: PNUD / Garth Cripps),Ecología,Lanzan iniciativa mundial para acabar con la basura marina y limpiar los océanos,https://noticiasdelaciencia.com/art/41513/lanzan-iniciativa-mundial-para-acabar-con-la-basura-marina-y-limpiar-los-oceanos
Redacción,,"Viernes, 23 de Abril de 2021",https://noticiasdelaciencia.com/upload/images/04_2021/9997_hallan-plastificantes-acumulados-en-el-tejido-muscular-de-tortugas.jpg,Ejemplar de tortuga boba (Caretta caretta). (Foto: CSIC),Contaminación,Hallan plastificantes acumulados en el tejido muscular de tortugas,https://noticiasdelaciencia.com/art/41583/hallan-plastificantes-acumulados-en-el-tejido-muscular-de-tortugas
Redacción,,"Viernes, 30 de Abril de 2021",https://noticiasdelaciencia.com/upload/images/04_2021/5201_sequia-provocada-por-acciones-humanas.jpg,El nuevo estudio ha sacado a la luz el origen principal de la tendencia a la sequía en el sector norte de Asia Central. (Imagen: Jie Jiang),Climatología,Sequia provocada por acciones humanas,https://noticiasdelaciencia.com/art/41633/sequia-provocada-por-acciones-humanas
Redacción,,"Viernes, 30 de Abril de 2021",https://noticiasdelaciencia.com/upload/images/04_2021/8837_cartuchos-de-tinta-de-impresora-a-la-deriva-por-el-mar.jpg,"Un cartucho de tinta aparecido en una playa de Cornualles y recogido por el Lost at Sea Project. (Foto: Tracey Williams, Lost at Sea Project)",Contaminación,Cartuchos de tinta de impresora a la deriva por el mar,https://noticiasdelaciencia.com/art/41638/cartuchos-de-tinta-de-impresora-a-la-deriva-por-el-mar
Redacción,,"Lunes, 03 de Mayo de 2021",https://noticiasdelaciencia.com/upload/images/05_2021/7500_el-verdadero-papel-ecologico-de-las-avispas.jpg,"Avispa de la especie Polistes satan atacando a una larva (oruga) del insecto Spodoptera frugiperda. Este último es una plaga importante del maíz y otros cultivos agrícolas. (Foto: Seirian Sumner, UCL)",Ecología,El verdadero papel ecológico de las avispas,https://noticiasdelaciencia.com/art/41647/el-verdadero-papel-ecologico-de-las-avispas
Redacción,,"Martes, 20 de Abril de 2021",,Roha -max,Salud,¿Qué es el tránsito intestinal?,https://noticiasdelaciencia.com/art/41543/que-es-el-transito-intestinal
Redacción,,"Martes, 20 de Abril de 2021",https://noticiasdelaciencia.com/upload/images/04_2021/8270_el-secreto-de-la-grasa-beige.jpg,"Adipocitos beige dentro de tejido adiposo blanco. Los adipocitos beige están tintados en verde, los lípidos en rojo y el ADN en azul. (Imagen: Ruth Karlina)",Medicina,El secreto de la grasa beige y su papel para combatir la obesidad impulsada por la grasa blanca,https://noticiasdelaciencia.com/art/41547/el-secreto-de-la-grasa-beige-y-su-papel-para-combatir-la-obesidad-impulsada-por-la-grasa-blanca
Redacción,,"Miércoles, 21 de Abril de 2021",https://noticiasdelaciencia.com/upload/images/04_2021/6689_higados-para-trasplantes-sin-sus-celulas-originales.jpg,Matriz extracelular de un hígado descelularizado. (Foto: HUG-CELL / USP),Medicina,Hígados para trasplantes sin sus células originales,https://noticiasdelaciencia.com/art/41555/higados-para-trasplantes-sin-sus-celulas-originales
Redacción,,"Miércoles, 21 de Abril de 2021",https://noticiasdelaciencia.com/upload/images/04_2021/2644_la-resistencia-a-los-antibioticos-se-puede-transmitir-de-animales.jpg,Bacterias Escherichia coli. (Imagen: NIAID),Medicina,La resistencia a los antibióticos se puede transmitir de animales a personas,https://noticiasdelaciencia.com/art/41561/la-resistencia-a-los-antibioticos-se-puede-transmitir-de-animales-a-personas
Redacción,,"Jueves, 22 de Abril de 2021",https://noticiasdelaciencia.com/upload/images/04_2021/3306_pegamento-para-el-cerebro-tras-una-lesion.jpg,Lohitash Karumbaiah trabajando en su laboratorio. (Foto: University of Georgia),Medicina,¿Pegamento para el cerebro tras una lesión?,https://noticiasdelaciencia.com/art/41569/pegamento-para-el-cerebro-tras-una-lesion
Redacción,,"Viernes, 23 de Abril de 2021",https://noticiasdelaciencia.com/upload/images/04_2021/5601_mucho-azucar-en-la-infancia-y-poca-memoria-en-la-adultez.jpg,Los cambios en el microbioma intestinal pueden perjudicar la función de la memoria asociada al hipocampo de la rata. (Imagen: Tom Deerinck / National Center for Microscopy and Imaging Research),Medicina,¿Comer mucho azúcar en la infancia y tener poca memoria en la adultez?,https://noticiasdelaciencia.com/art/41578/comer-mucho-azucar-en-la-infancia-y-tener-poca-memoria-en-la-adultez
Redacción,,"Martes, 27 de Abril de 2021",https://noticiasdelaciencia.com/upload/images/04_2021/3484_disenan-el-primer-implante-corneal-trifocal-para-corregir-la-presbicia.jpg,Se ha diseñado el primer implante corneal trifocal para corregir la presbicia. (Foto: UPV),Óptica,Diseñan el primer implante corneal trifocal para corregir la presbicia,https://noticiasdelaciencia.com/art/41608/disenan-el-primer-implante-corneal-trifocal-para-corregir-la-presbicia
Redacción,,"Viernes, 23 de Abril de 2021",https://noticiasdelaciencia.com/upload/images/04_2021/8525_la-hormona-de-crecimiento-podria-favorecer-la-ovulacion.jpg,"Según los resultados del nuevo estudio, la hormona de crecimiento podría favorecer la ovulación en mujeres con ovarios poliquísticos. (Foto: MARGen)",Medicina,La hormona de crecimiento podría favorecer la ovulación en mujeres con ovarios poliquísticos,https://noticiasdelaciencia.com/art/41582/la-hormona-de-crecimiento-podria-favorecer-la-ovulacion-en-mujeres-con-ovarios-poliquisticos
Redacción,,"Miércoles, 28 de Abril de 2021",https://noticiasdelaciencia.com/upload/images/04_2021/7288_regeneracion-completa-del-corazon-con-la-activacion-de-un-gen.jpg,Kazu Kikuchi. (Foto: Victor Chang Cardiac Research Institute),Medicina,¿Regeneración completa del corazón con la activación de un gen especial?,https://noticiasdelaciencia.com/art/41617/regeneracion-completa-del-corazon-con-la-activacion-de-un-gen-especial
Redacción,,"Miércoles, 28 de Abril de 2021",https://noticiasdelaciencia.com/upload/images/04_2021/758_ejercicio-fisico-para-reducir-el-riesgo-de-muerte.jpg,En el nuevo estudio se ha determinado que la actividad física regular puede reducir en un tercio el riesgo de muerte por COVID-19. (Foto: UCA),Medicina,Ejercicio físico para reducir el riesgo de muerte por COVID-19,https://noticiasdelaciencia.com/art/41621/ejercicio-fisico-para-reducir-el-riesgo-de-muerte-por-covid-19
Redacción,,"Jueves, 29 de Abril de 2021",https://noticiasdelaciencia.com/upload/images/04_2021/5364_perros-que-detectan-al-coronavirus-por-el-olor.jpg,"Poncho, un labrador retriever amarillo de dos años y medio, fue uno de los perros entrenados con éxito en este estudio. (Foto: Pat Nolan)",Conducta animal,Perros que detectan al coronavirus por el olor,https://noticiasdelaciencia.com/art/41625/perros-que-detectan-al-coronavirus-por-el-olor
Redacción,,"Lunes, 19 de Abril de 2021",https://noticiasdelaciencia.com/upload/images/04_2021/4076_identifican-factores-epigeneticos-que-predicen-la-gravedad.jpg,Imagen captada mediante microscopio electrónico de barrido y procesada en la que aparece una célula moribunda atacada por partículas víricas (en verde) del coronavirus SARS-CoV-2. (Imagen: NIAID / NIH),Medicina,Identifican factores epigenéticos que predicen la gravedad de la COVID-19,https://noticiasdelaciencia.com/art/41540/identifican-factores-epigeneticos-que-predicen-la-gravedad-de-la-covid-19
Redacción,,"Martes, 20 de Abril de 2021",https://noticiasdelaciencia.com/upload/images/04_2021/1061_celulas-madre-para-curar-el-glaucoma.jpg,Células madre en la superficie de una retina a las dos semanas del trasplante. (Imagen: Molecular Therapy - Methods and Clinical Development),Medicina,¿Células madre para curar el glaucoma?,https://noticiasdelaciencia.com/art/41545/celulas-madre-para-curar-el-glaucoma
Redacción,,"Miércoles, 21 de Abril de 2021",https://noticiasdelaciencia.com/upload/images/04_2021/3561_lo-que-revela-de-la-covid-19-el-mapa.jpg,Mapa de Estados Unidos mostrando la cantidad de fallecimientos adicionales por cada cien mil personas en cada uno de los estados de la nación desde el 1 de marzo de 2020 hasta el 2 de enero de 2021. (Imagen: Virginia Commonwealth University),Medicina,Lo que revela de la COVID-19 el mapa de fallecimientos de un país,https://noticiasdelaciencia.com/art/41554/lo-que-revela-de-la-covid-19-el-mapa-de-fallecimientos-de-un-pais
Redacción,,"Miércoles, 21 de Abril de 2021",https://noticiasdelaciencia.com/upload/images/04_2021/5681_descubren-mutaciones-en-celulas-sanguineas-que-promueven.jpg,"María Ángeles Zuriaga, Mirian Díez, Fátima Sánchez-Cabo, Ana Dopazo, José Javier Fuster, Ana Quintas y Jorge de la Barrera, miembros del equipo de investigación. (Foto: CNIC)",Medicina,Descubren mutaciones en células sanguíneas que promueven la insuficiencia cardiaca,https://noticiasdelaciencia.com/art/41559/descubren-mutaciones-en-celulas-sanguineas-que-promueven-la-insuficiencia-cardiaca
Redacción,,"Jueves, 22 de Abril de 2021",https://noticiasdelaciencia.com/upload/images/04_2021/3510_descubren-la-causa-de-la-neurodegeneracion.jpg,Los doctores Jordi Duran y Joan J Guinovart. (Imágenes: UB / IRB Barcelona),Neurología,Descubren la causa de la neurodegeneración en la enfermedad de Lafora,https://noticiasdelaciencia.com/art/41571/descubren-la-causa-de-la-neurodegeneracion-en-la-enfermedad-de-lafora
Redacción,,"Jueves, 22 de Abril de 2021",https://noticiasdelaciencia.com/upload/images/04_2021/5481_mapa-mundial-de-madres-que-han-sufrido-la-muerte-de-un-hijo.jpg,"Tasa de madres que han sufrido la muerte de un hijo o hija. El nivel de incidencia comienza desde el color blanco (la más pequeña). A medida que la incidencia crece, el color adquiere un tono verde cada vez más intenso y que luego se va oscureciendo hasta convertirse en color negro (la incidencia más alta). En color gris se muestran las zonas de las que no ha sido posible obtener datos. (Imagen: USC Dornsife College of Letters, Arts and Sciences)",Demografía,Mapa mundial de madres que han sufrido la muerte de un hijo o hija,https://noticiasdelaciencia.com/art/41565/mapa-mundial-de-madres-que-han-sufrido-la-muerte-de-un-hijo-o-hija
Redacción,,"Viernes, 23 de Abril de 2021",https://noticiasdelaciencia.com/upload/images/04_2021/8207_unas-85-000-personas-mueren-al-ano-por-el-alcohol.jpg,Un hombre ebrio duerme en un barco. (Foto: OMS / Sergey Volkov),Medicina,"Unas 85.000 personas mueren al año por el alcohol en América, el mayor consumidor mundial",https://noticiasdelaciencia.com/art/41580/unas-85000-personas-mueren-al-ano-por-el-alcohol-en-america-el-mayor-consumidor-mundial
Redacción,,"Miércoles, 28 de Abril de 2021",https://noticiasdelaciencia.com/upload/images/04_2021/2121_77a5785.jpg,,Medicina,"Gotas, lentes correctoras nocturnas… ¿Sabes cuáles son los últimos avances contra la miopía?",https://noticiasdelaciencia.com/art/41609/gotas-lentes-correctoras-nocturnas-sabes-cuales-son-los-ultimos-avances-contra-la-miopia
Redacción,,"Miércoles, 28 de Abril de 2021",https://noticiasdelaciencia.com/upload/images/04_2021/9297_luz-azul-y-bacterias-de-la-brucelosis.jpg,Bacterias de la brucelosis en una imagen captada mediante microscopio electrónico de barrido. (Foto: Magalí Bialer),Medicina,"Luz azul y bacterias de la brucelosis, una combinación peligrosa",https://noticiasdelaciencia.com/art/41619/luz-azul-y-bacterias-de-la-brucelosis-una-combinacion-peligrosa
Redacción,,"Viernes, 23 de Abril de 2021",https://noticiasdelaciencia.com/upload/images/04_2021/2396_mallas-quirurgicas-de-bionanocelulosa-para-mejorar-la-cirugia.jpg,"Sole Roig, investigadora en el grupo NN del ICMAB-CSIC, enseña una muestra de una malla quirúrgica de polipropileno y nanocelulosa bacteriana. (Foto: ICMAB-CSIC)",Tecnología médica,Mallas quirúrgicas de bionanocelulosa para mejorar la cirugía de hernias abdominales,https://noticiasdelaciencia.com/art/41584/mallas-quirurgicas-de-bionanocelulosa-para-mejorar-la-cirugia-de-hernias-abdominales
Redacción,,"Jueves, 29 de Abril de 2021",,,Salud,Avances de la tecnología del cepillado,https://noticiasdelaciencia.com/art/41622/avances-de-la-tecnologia-del-cepillado
,,"Viernes, 30 de Septiembre de 2011",,,,Entrevistas publicadas en 2011,https://noticiasdelaciencia.com/art/1432/entrevistas-publicadas-en-2011
,,"Lunes, 09 de Julio de 2012",,,Entrevistas,Entrevistas publicadas en 2012,https://noticiasdelaciencia.com/art/3963/entrevistas-publicadas-en-2012
,,"Martes, 27 de Agosto de 2013",,,,Artículos extensos y reportajes publicados en 2013,https://noticiasdelaciencia.com/art/6503/articulos-extensos-y-reportajes-publicados-en-2013
,,"Miércoles, 05 de Marzo de 2014",upload/img/periodico/img_18588.jpg,,Divulgación,"Fundación Telefónica lleva 15 años apoyando el cruce entre arte, ciencia y tecnología con los premios Vida",https://noticiasdelaciencia.com/art/9740/fundacion-telefonica-lleva-15-anos-apoyando-el-cruce-entre-arte-ciencia-y-tecnologia-con-los-premios-vida
,,"Jueves, 06 de Abril de 2017",,,Negocios,"Su empresa, página web o producto, reseñados en NCYT Amazings",https://noticiasdelaciencia.com/art/23789/su-empresa-pagina-web-o-producto-resenados-en-ncyt-amazings
,,"Miércoles, 16 de Marzo de 2016",,,Artículo,"La evolución de las astilladoras, los caballetes de leña y los aserraderos portátiles",https://noticiasdelaciencia.com/art/18921/la-evolucion-de-las-astilladoras-los-caballetes-de-lena-y-los-aserraderos-portatiles
Redacción,,"Miércoles, 18 de Diciembre de 2019",,,Artículo,Tipos de publicidad,https://noticiasdelaciencia.com/art/35879/tipos-de-publicidad
,,"Martes, 01 de Febrero de 2011",,,,Artículos extensos anteriores al 1 de Enero de 2011,https://noticiasdelaciencia.com/art/1430/articulos-extensos-anteriores-al-1-de-enero-de-2011
Redacción,,"Lunes, 15 de Marzo de 2021",https://noticiasdelaciencia.com/upload/images/03_2021/1522_stock-market.jpg,,Ciencia económica,Comprensión de la correlación entre el petróleo y la moneda,https://noticiasdelaciencia.com/art/41274/comprension-de-la-correlacion-entre-el-petroleo-y-la-moneda
,,"Viernes, 16 de Diciembre de 2011",,,,Artículos extensos y reportajes publicados en 2011,https://noticiasdelaciencia.com/art/1431/articulos-extensos-y-reportajes-publicados-en-2011
Redacción,,"Martes, 19 de Noviembre de 2019",https://noticiasdelaciencia.com/upload/images/11_2019/9772_9788449336263.jpg,,Libros,El sorprendente libro de las rarezas matemáticas (David Darling y Agnijo Banerjee),https://noticiasdelaciencia.com/art/35350/el-sorprendente-libro-de-las-rarezas-matematicas-david-darling-y-agnijo-banerjee
,,"Lunes, 15 de Octubre de 2012",,,,Artículos extensos y reportajes publicados en 2012,https://noticiasdelaciencia.com/art/3239/articulos-extensos-y-reportajes-publicados-en-2012
