author,content,date,image,image_content,tag,title,url
Redacción,,"Jueves, 23 de Enero de 2020",https://noticiasdelaciencia.com/upload/images/01_2020/5314_9788449336515.jpg,,Libros,Respuestas sorprendentes a preguntas cotidianas (Jordi Pereyra),https://noticiasdelaciencia.com/art/36340/respuestas-sorprendentes-a-preguntas-cotidianas-jordi-pereyra
Redacción,,"Lunes, 10 de Febrero de 2020",https://noticiasdelaciencia.com/upload/images/02_2020/9791_9788494569890.jpg,,Libros,Ada Lovelace (Jordi Bayarri/Dani Seijas),https://noticiasdelaciencia.com/art/36630/ada-lovelace-jordi-bayarridani-seijas
Redacción,,"Viernes, 21 de Febrero de 2020",https://noticiasdelaciencia.com/upload/images/02_2020/6143_00106522319489____2__640x640.jpg,,Libros,Viajeras por el lejano oriente (1847-1910) (Pilar Tejera),https://noticiasdelaciencia.com/art/36834/viajeras-por-el-lejano-oriente-1847-1910-pilar-tejera
,,"Jueves, 10 de Diciembre de 2015",,,Artículo,5 claves para elegir naves industriales en Barcelona,https://noticiasdelaciencia.com/art/17366/5-claves-para-elegir-naves-industriales-en-barcelona
,,"Viernes, 24 de Enero de 2014",,,,Artículos extensos y reportajes publicados en 2014,https://noticiasdelaciencia.com/art/9483/articulos-extensos-y-reportajes-publicados-en-2014
,,"Lunes, 27 de Febrero de 2017",upload/img/periodico/img_42070.jpg,,Internet,¿Cómo elegir a un bróker Forex?,https://noticiasdelaciencia.com/art/23211/como-elegir-a-un-broker-forex
Redacción,,"Lunes, 26 de Febrero de 2018",upload/img/periodico/img_49280.jpg,,Internet,Claves para reconocer las mejores ofertas para préstamos personales,https://noticiasdelaciencia.com/art/27587/claves-para-reconocer-las-mejores-ofertas-para-prestamos-personales
Redacción,,"Martes, 03 de Noviembre de 2020",https://noticiasdelaciencia.com/upload/images/11_2020/4732_dinero.jpg,,Negocios,¿Cómo la Portabilidad Financiera está ayudando a la economía de los Chilenos?,https://noticiasdelaciencia.com/art/40058/como-la-portabilidad-financiera-esta-ayudando-a-la-economia-de-los-chilenos
Redacción,,"Viernes, 19 de Marzo de 2021",https://noticiasdelaciencia.com/upload/images/03_2021/1049_forex12.jpg,,Economía,4 errores a evitar cuando se opera en Forex,https://noticiasdelaciencia.com/art/41325/4-errores-a-evitar-cuando-se-opera-en-forex
Redacción,,"Jueves, 12 de Marzo de 2020",https://noticiasdelaciencia.com/upload/images/03_2020/5456_9788423431328.jpg,,Libros,La era de la disrupción digital (Javier Andrés y Rafael Doménech),https://noticiasdelaciencia.com/art/37087/la-era-de-la-disrupcion-digital-javier-andres-y-rafael-domenech
Redacción,,"Martes, 02 de Junio de 2020",https://noticiasdelaciencia.com/upload/images/06_2020/6700_9788408221548.jpg,,Libros,Cielos Oscuros (Valerie Stimac),https://noticiasdelaciencia.com/art/38316/cielos-oscuros-valerie-stimac
Redacción,,"Viernes, 03 de Julio de 2020",https://noticiasdelaciencia.com/upload/images/07_2020/7791_9788446048725.jpg,"(Fuente: ,)",Libros,Las entidades oscuras (Cristiano Galbiati),https://noticiasdelaciencia.com/art/38718/las-entidades-oscuras-cristiano-galbiati
Redacción,,"Viernes, 04 de Septiembre de 2020",https://noticiasdelaciencia.com/upload/images/09_2020/4961_9788499467658.jpg,,Libros,"Coronavirus, tras la vacuna (Luis Miguel Benito de Benito)",https://noticiasdelaciencia.com/art/39411/coronavirus-tras-la-vacuna-luis-miguel-benito-de-benito
Redacción,,"Jueves, 12 de Noviembre de 2020",,"El 12 de diciembre de 1965 se producía el primer intento de lanzamiento de la misión tripulada Gemini 6, cuyos ocupantes debían reunirse en el espacio con sus compañeros de la Gemini 7. El despegue, sin embargo, tuvo que ser abortado, y los astronautas Schirra y Stafford se encontraron en la necesidad de tomar una decisión para la que jamás habían sido entrenados.",Video,Pero ¿hemos despegado o no?,https://noticiasdelaciencia.com/art/40175/pero-hemos-despegado-o-no
Redacción,,"Viernes, 09 de Octubre de 2020",https://noticiasdelaciencia.com/upload/images/10_2020/5173_9788491818878.jpg,"(Fuente: ,)",Libros,Una grieta en la creación (Jennifer A. Doudna y Samuel H. Sternberg),https://noticiasdelaciencia.com/art/39792/una-grieta-en-la-creacion-jennifer-a-doudna-y-samuel-h-sternberg
Redacción,,"Viernes, 29 de Enero de 2021",https://noticiasdelaciencia.com/upload/images/01_2021/845_00000001-0000-0011-0000-000002082763-1.jpg,,Libros,Pasteur (Jordi Bayarri/Dani Seijas),https://noticiasdelaciencia.com/art/40927/pasteur-jordi-bayarridani-seijas
Redacción,,"Viernes, 05 de Marzo de 2021",https://noticiasdelaciencia.com/upload/images/03_2021/4148_9788491992752.jpg,,Libros,El fin de todo (Katie Mack),https://noticiasdelaciencia.com/art/41207/el-fin-de-todo-katie-mack
Redacción,,"Viernes, 09 de Abril de 2021",https://noticiasdelaciencia.com/upload/images/04_2021/6837_9788413620732.jpg,,Libros,La vuelta al mundo en seis millones de años (Guido Barbujani y Andrea Brunelli),https://noticiasdelaciencia.com/art/41458/la-vuelta-al-mundo-en-seis-millones-de-anos-guido-barbujani-y-andrea-brunelli
Redacción,,"Viernes, 19 de Marzo de 2021",https://noticiasdelaciencia.com/upload/images/03_2021/5182_portada_la-arqueologia-desde-el-espacio_sarah-parcak_202101181351.jpg,,Libros,La arqueología desde el espacio (Sarah Parcak),https://noticiasdelaciencia.com/art/41318/la-arqueologia-desde-el-espacio-sarah-parcak
Redacción,,"Viernes, 23 de Abril de 2021",https://noticiasdelaciencia.com/upload/images/04_2021/5277_9788491992783.jpg,,Libros,Dioses y mendigos (José María Bermúdez de Castro),https://noticiasdelaciencia.com/art/41574/dioses-y-mendigos-jose-maria-bermudez-de-castro
Redacción,,"Viernes, 13 de Diciembre de 2019",https://noticiasdelaciencia.com/upload/images/12_2019/4384_9788491816836.jpg,,Libros,Conocer la meteorología (José Miguel Viñas),https://noticiasdelaciencia.com/art/35789/conocer-la-meteorologia-jose-miguel-vinas
Redacción,,"Jueves, 30 de Enero de 2020",https://noticiasdelaciencia.com/upload/images/01_2020/9935_41pamtzvokl.jpg,,Libros,Cómo crear un ser humano (Philip Ball),https://noticiasdelaciencia.com/art/36461/como-crear-un-ser-humano-philip-ball
Redacción,,"Viernes, 14 de Febrero de 2020",https://noticiasdelaciencia.com/upload/images/02_2020/6939_9788467056563.jpg,,Libros,En busca del fuego... (José Antonio Cabezas),https://noticiasdelaciencia.com/art/36705/en-busca-del-fuego-jose-antonio-cabezas
Redacción,,"Jueves, 27 de Febrero de 2020",https://noticiasdelaciencia.com/upload/images/02_2020/105_9788446048039.jpg,,Libros,Virus (Marilyn J. Roossinck),https://noticiasdelaciencia.com/art/36893/virus-marilyn-j-roossinck
Redacción,,"Jueves, 19 de Marzo de 2020",https://noticiasdelaciencia.com/upload/images/03_2020/7229_9788499887494.jpg,,Libros,Secretos de tu cerebro (Gemma Sala y Alexia de la Morena),https://noticiasdelaciencia.com/art/37189/secretos-de-tu-cerebro-gemma-sala-y-alexia-de-la-morena
Redacción,,"Viernes, 26 de Junio de 2020",https://noticiasdelaciencia.com/upload/images/06_2020/5363_9788441542372.jpg,,Libros,¿Qué es el VIH? (Eduardo López-Collazo),https://noticiasdelaciencia.com/art/38623/que-es-el-vih-eduardo-lopez-collazo
Redacción,,"Martes, 11 de Agosto de 2020",https://noticiasdelaciencia.com/upload/images/08_2020/4616_9788441542846.jpg,"(Fuente: ,)",Libros,"Coronavirus, ¿la última pandemia? (José Alcamí Pertejo y Eduardo López-Collazo)",https://noticiasdelaciencia.com/art/39126/coronavirus-la-ultima-pandemia-jose-alcami-pertejo-y-eduardo-lopez-collazo
Redacción,,"Viernes, 25 de Septiembre de 2020",https://noticiasdelaciencia.com/upload/images/09_2020/699_9788408216728.jpg,,Libros,El universo,https://noticiasdelaciencia.com/art/39637/el-universo
Redacción,,"Viernes, 23 de Octubre de 2020",https://noticiasdelaciencia.com/upload/images/10_2020/6865_9788491992431.jpg,,Libros,Somos polvo de estrellas (José María Maza Sancho),https://noticiasdelaciencia.com/art/39932/somos-polvo-de-estrellas-jose-maria-maza-sancho
Redacción,,"Viernes, 26 de Febrero de 2021",https://noticiasdelaciencia.com/upload/images/02_2021/1596_9788413621388.jpg,,Libros,La arrogancia de la biología (Sheila Janasoff),https://noticiasdelaciencia.com/art/41157/la-arrogancia-de-la-biologia-sheila-janasoff
Redacción,,"Lunes, 23 de Noviembre de 2020",,"Curiosidades de la Ciencia 1. ""Los errores de Lord Kelvin"". ,Uno de los más geniales y famosos científicos de la historia, lord Kelvin, fue responsable de numerosos aciertos pero también de grandes errores que demuestran que incluso las grandes personalidades de la ciencia pueden llegar a equivocarse. ,Música: Manel Montes",Video,Los errores de Lord Kelvin,https://noticiasdelaciencia.com/art/40288/los-errores-de-lord-kelvin
Redacción,,"Viernes, 12 de Marzo de 2021",https://noticiasdelaciencia.com/upload/images/03_2021/5151_9788408223429.jpg,,Libros,"Allá Arriba (Pezzuli, Orofino, Schneider, Valiante, Gallerani, Sbarrato, Vecchini y Beniero)",https://noticiasdelaciencia.com/art/41260/alla-arriba-pezzuli-orofino-schneider-valiante-gallerani-sbarrato-vecchini-y-beniero
Redacción,,"Viernes, 16 de Abril de 2021",https://noticiasdelaciencia.com/upload/images/04_2021/9191_9788413620985.jpg,,Antropología,Humanos. ¿O no? (Camilo J. Cela Conde y Francisco J. Ayala),https://noticiasdelaciencia.com/art/41516/humanos-o-no-camilo-j-cela-conde-y-francisco-j-ayala
Redacción,,"Martes, 30 de Marzo de 2021",,Noticias de la actualidad científica y tecnológica del 25 de marzo de 2021.,Video,"Noticias de la Ciencia y la Tecnología, 25 de Marzo de 2021",https://noticiasdelaciencia.com/art/41401/noticias-de-la-ciencia-y-la-tecnologia-25-de-marzo-de-2021
Redacción,,"Viernes, 26 de Marzo de 2021",https://noticiasdelaciencia.com/upload/images/03_2021/3705_9788413620749.jpg,,Libros,Ondas: Una breve introducción (Mike Goldsmith),https://noticiasdelaciencia.com/art/41373/ondas-una-breve-introduccion-mike-goldsmith
Redacción,,"Martes, 06 de Abril de 2021",,Noticias de la actualidad científica y tecnológica del 29 de marzo de 2021.,Video,"Noticias de la Ciencia y la Tecnología, 29 de Marzo de 2021",https://noticiasdelaciencia.com/art/41427/noticias-de-la-ciencia-y-la-tecnologia-29-de-marzo-de-2021
Redacción,,"Viernes, 30 de Abril de 2021",https://noticiasdelaciencia.com/upload/images/04_2021/1599_9788413621890.jpg,,Libros,¿Somos nuestro cerebro? (Fernando Vidal y Francisco Ortega),https://noticiasdelaciencia.com/art/41632/somos-nuestro-cerebro-fernando-vidal-y-francisco-ortega
Redacción,,"Lunes, 03 de Mayo de 2021",https://noticiasdelaciencia.com/upload/images/05_2021/8559_la-amenaza-de-los-pozos-petroliferos-inactivos.jpg,Jacob Hoschouer tomando muestras de un pozo petrolífero inactivo. (Foto: UC Geology),Contaminación,La amenaza de los pozos petrolíferos inactivos,https://noticiasdelaciencia.com/art/41651/la-amenaza-de-los-pozos-petroliferos-inactivos
Redacción,,"Lunes, 03 de Mayo de 2021",https://noticiasdelaciencia.com/upload/images/05_2021/5976_predecir-deslizamientos-de-tierra-en-zonas-semiaridas.jpg,Vista aérea de la zona estudiada. (Foto: Universidad de Almería),Geología,Predecir deslizamientos de tierra en zonas semiáridas,https://noticiasdelaciencia.com/art/41653/predecir-deslizamientos-de-tierra-en-zonas-semiaridas
Redacción,,"Lunes, 03 de Mayo de 2021",https://noticiasdelaciencia.com/upload/images/05_2021/7231_la-singular-anatomia-del-gusano-que-parece-un-arbol.jpg,"Fragmento de la parte anterior de un ejemplar de Ramisyllis multicaudata, con la cabeza y las primeras ramificaciones. (Imagen: UAM)",Zoología,La singular anatomía del gusano que parece un árbol,https://noticiasdelaciencia.com/art/41655/la-singular-anatomia-del-gusano-que-parece-un-arbol
Redacción,,"Martes, 04 de Mayo de 2021",https://noticiasdelaciencia.com/upload/images/05_2021/2194_embrion-de-humano-y-mono.jpg,"Un blastocisto de quimera humano-mono. (Imagen: Weizhi Ji, Kunming University of Science and Technology)",Biología,Embrión de humano y mono,https://noticiasdelaciencia.com/art/41657/embrion-de-humano-y-mono
Redacción,,"Martes, 04 de Mayo de 2021",https://noticiasdelaciencia.com/upload/images/05_2021/9613_robots-de-adn-mas-complejos-y-disenados-en-minutos.jpg,"Este ""avión"", formado por hebras de ADN, es mil veces más pequeño que el grosor de un cabello humano. (Imagen: Ohio State University)",Nanotecnología,Robots de ADN más complejos y diseñados en minutos en vez de en días,https://noticiasdelaciencia.com/art/41661/robots-de-adn-mas-complejos-y-disenados-en-minutos-en-vez-de-en-dias
Redacción,,"Martes, 04 de Mayo de 2021",https://noticiasdelaciencia.com/upload/images/05_2021/7606_cuantos-tiranosaurios-rex-vivieron-en-la-tierra.jpg,"Un molde de un esqueleto de T. rex expuesto en el exterior del Museo de Paleontología de la Universidad de California, en Berkeley. El original, un esqueleto casi completo desenterrado en 1990 en las tierras baldías del este de Montana, se encuentra en el Museo de las Rocosas en Bozeman, Montana. (Foto: Keegan Houser, UC Berkeley)",Paleontología,¿Cuántos Tiranosaurios rex vivieron en la Tierra?,https://noticiasdelaciencia.com/art/41663/cuantos-tiranosaurios-rex-vivieron-en-la-tierra
Redacción,,"Martes, 04 de Mayo de 2021",https://noticiasdelaciencia.com/upload/images/05_2021/4643_un-mismo-farmaco-puede-tener-efectos-opuestos.jpg,"Los miembros del grupo de investigación sobre mecanismos traslaciones de la memoria del miedo que lidera Raül Andero, tercero por la izquierda, en el INc-UAB. (Foto: INc-UAB)",Neurología,Un mismo fármaco puede tener efectos opuestos sobre la memoria según el sexo,https://noticiasdelaciencia.com/art/41665/un-mismo-farmaco-puede-tener-efectos-opuestos-sobre-la-memoria-segun-el-sexo
Redacción,,"Jueves, 08 de Abril de 2021",,Noticias de la actualidad científica y tecnológica del 31 de marzo de 2021.,Video,"Noticias de la Ciencia y la Tecnología, 31 de Marzo de 2021",https://noticiasdelaciencia.com/art/41449/noticias-de-la-ciencia-y-la-tecnologia-31-de-marzo-de-2021
Redacción,,"Martes, 04 de Mayo de 2021",https://noticiasdelaciencia.com/upload/images/05_2021/4640_luz-solar-para-potabilizar-agua-a-bajo-coste.jpg,El evaporador fototérmico diseñado puede ser la clave para dar un gran salto hacia un abastecimiento suficiente de agua plenamente potable para millones de personas que ahora sufren su escasez y deben confiar en agua de potabilización precaria. (Imagen: University of South Australia),Ingeniería,Luz solar para potabilizar agua a bajo coste,https://noticiasdelaciencia.com/art/41659/luz-solar-para-potabilizar-agua-a-bajo-coste
Redacción,,"Lunes, 12 de Abril de 2021",,Noticias de la actualidad científica y tecnológica del 7 de abril de 2021.,Video,"Noticias de la Ciencia y la Tecnología, 7 de Abril de 2021",https://noticiasdelaciencia.com/art/41473/noticias-de-la-ciencia-y-la-tecnologia-7-de-abril-de-2021
Redacción,,"Miércoles, 14 de Abril de 2021",,Noticias de la actualidad científica y tecnológica del 9 de abril de 2021.,Video,"Noticias de la Ciencia y la Tecnología, 9 de Abril de 2021",https://noticiasdelaciencia.com/art/41494/noticias-de-la-ciencia-y-la-tecnologia-9-de-abril-de-2021
Redacción,,"Viernes, 16 de Abril de 2021",,Noticias de la actualidad científica y tecnológica del 13 de abril de 2021.,Video,"Noticias de la Ciencia y la Tecnología, 13 de Abril de 2021",https://noticiasdelaciencia.com/art/41518/noticias-de-la-ciencia-y-la-tecnologia-13-de-abril-de-2021
Redacción,,"Martes, 20 de Abril de 2021",,Noticias de la actualidad científica y tecnológica del 15 de abril de 2021.,Video,"Noticias de la Ciencia y la Tecnología, 15 de Abril de 2021",https://noticiasdelaciencia.com/art/41541/noticias-de-la-ciencia-y-la-tecnologia-15-de-abril-de-2021
Redacción,,"Jueves, 22 de Abril de 2021",,Noticias de la actualidad científica y tecnológica del 19 de abril de 2021.,Video,"Noticias de la Ciencia y la Tecnología, 19 de Abril de 2021",https://noticiasdelaciencia.com/art/41564/noticias-de-la-ciencia-y-la-tecnologia-19-de-abril-de-2021
Redacción,,"Miércoles, 28 de Abril de 2021",,Noticias de la actualidad científica y tecnológica del 23 de abril de 2021.,Video,"Noticias de la Ciencia y la Tecnología, 23 de Abril de 2021",https://noticiasdelaciencia.com/art/41612/noticias-de-la-ciencia-y-la-tecnologia-23-de-abril-de-2021
Redacción,,"Martes, 23 de Marzo de 2021",,Noticias de la actualidad científica y tecnológica del 18 de marzo de 2021.,Video,"Noticias de la Ciencia y la Tecnología, 18 de Marzo de 2021",https://noticiasdelaciencia.com/art/41340/noticias-de-la-ciencia-y-la-tecnologia-18-de-marzo-de-2021
Redacción,,"Lunes, 26 de Abril de 2021",,Noticias de la actualidad científica y tecnológica del 21 de abril de 2021.,Video,"Noticias de la Ciencia y la Tecnología, 21 de Abril de 2021",https://noticiasdelaciencia.com/art/41589/noticias-de-la-ciencia-y-la-tecnologia-21-de-abril-de-2021
Redacción,,"Viernes, 30 de Abril de 2021",,Noticias de la actualidad científica y tecnológica del 27 de abril de 2021.,Video,"Noticias de la Ciencia y la Tecnología, 27 de Abril de 2021",https://noticiasdelaciencia.com/art/41631/noticias-de-la-ciencia-y-la-tecnologia-27-de-abril-de-2021
Redacción,,"Lunes, 29 de Marzo de 2021",,Noticias de la actualidad científica y tecnológica del 24 de marzo de 2021.,Video,"Noticias de la Ciencia y la Tecnología, 24 de Marzo de 2021",https://noticiasdelaciencia.com/art/41389/noticias-de-la-ciencia-y-la-tecnologia-24-de-marzo-de-2021
Redacción,,"Jueves, 25 de Marzo de 2021",,Noticias de la actualidad científica y tecnológica del 22 de marzo de 2021.,Video,"Noticias de la Ciencia y la Tecnología, 22 de Marzo de 2021",https://noticiasdelaciencia.com/art/41365/noticias-de-la-ciencia-y-la-tecnologia-22-de-marzo-de-2021
Redacción,,"Miércoles, 31 de Marzo de 2021",,Noticias de la actualidad científica y tecnológica del 26 de marzo de 2021.,Video,"Noticias de la Ciencia y la Tecnología, 26 de Marzo de 2021",https://noticiasdelaciencia.com/art/41412/noticias-de-la-ciencia-y-la-tecnologia-26-de-marzo-de-2021
Redacción,,"Miércoles, 05 de Mayo de 2021",https://noticiasdelaciencia.com/upload/images/05_2021/1831_la-pintura-mas-blanca-y-refrigerante.jpg,"Xiulin Ruan sostiene una muestra de la que, por ahora, es la pintura más blanca de la que se tiene conocimiento. (Foto: Purdue University / Jared Pike)",Química,La pintura más blanca y refrigerante,https://noticiasdelaciencia.com/art/41670/la-pintura-mas-blanca-y-refrigerante
Redacción,,"Miércoles, 05 de Mayo de 2021",https://noticiasdelaciencia.com/upload/images/05_2021/3212_descontaminar-agua-de-un-modo-mas-respetuoso.jpg,Una solución acuosa con azul de metileno antes y después de ser tratada con el hidrogel de lignocelulosa desarrollado en el KTH. (Fotos: Giuseppe Melilli),Química,Descontaminar agua de un modo más respetuoso con el medioambiente,https://noticiasdelaciencia.com/art/41672/descontaminar-agua-de-un-modo-mas-respetuoso-con-el-medioambiente
Redacción,,"Miércoles, 05 de Mayo de 2021",https://noticiasdelaciencia.com/upload/images/05_2021/6726_vinescout-el-robot-de-observacion-para-la-viticultura-del-futuro.jpg,Miembros del equipo con el robot VineScout. (Foto: UPV),Robótica agrícola,"VineScout, el robot de observación para la viticultura del futuro",https://noticiasdelaciencia.com/art/41674/vinescout-el-robot-de-observacion-para-la-viticultura-del-futuro
Redacción,,"Miércoles, 05 de Mayo de 2021",https://noticiasdelaciencia.com/upload/images/05_2021/7263_diagnosticos-automaticos-a-distancia-de-monumentos.jpg,Dispositivo sensor en el sitio de estudio. Se indica su longitud. (Foto: Fundación Descubre),Tecnología,Diagnósticos automáticos y a distancia de monumentos,https://noticiasdelaciencia.com/art/41676/diagnosticos-automaticos-y-a-distancia-de-monumentos
Redacción,,"Jueves, 06 de Mayo de 2021",https://noticiasdelaciencia.com/upload/images/05_2021/7080_madera-transparente-mas-ecologica.jpg,"Se utiliza un extracto de residuos de la producción de zumo de naranja para crear el polímero que restablece la fortaleza de la madera deslignificada y permite el paso de la luz, dándole transparencia. (Imagen: Céline Montanari)",Ciencia de los materiales,Madera transparente más ecológica,https://noticiasdelaciencia.com/art/41680/madera-transparente-mas-ecologica
Redacción,,"Jueves, 06 de Mayo de 2021",https://noticiasdelaciencia.com/upload/images/05_2021/3102_detectar-la-insuficiencia-cardiaca-a-partir-de-la-saliva.jpg,Dispositivo sensor desarrollado en el proyecto KardiaTool. (Foto: IMB / CNM / CSIC),Tecnología médica,Detectar la insuficiencia cardiaca a partir de la saliva,https://noticiasdelaciencia.com/art/41678/detectar-la-insuficiencia-cardiaca-a-partir-de-la-saliva
Redacción,,"Jueves, 06 de Mayo de 2021",https://noticiasdelaciencia.com/upload/images/05_2021/8222_afinidades-biogeograficas-en-la-flora-cretacica-de-dos-islas.jpg,"Imágenes de microscopia electrónica de barrido de los girogonitos de la nueva especie Mesochara dobrogeica (A, B, C, D) y de los utrículos de la nueva variedad Clavator ampullaceus var. latibracteatus (E, F, G, H), descubiertas en la región de Dobrogea (Rumanía).",Paleontología,Afinidades biogeográficas en la flora cretácica de dos islas del antiguo mar de Tetis,https://noticiasdelaciencia.com/art/41682/afinidades-biogeograficas-en-la-flora-cretacica-de-dos-islas-del-antiguo-mar-de-tetis
Redacción,,"Lunes, 03 de Mayo de 2021",https://noticiasdelaciencia.com/upload/images/05_2021/4287_fosforo-negro-para-desgarrar-microbios-patogenos.jpg,Una célula fúngica (en verde) interactuando con una capa de grosor nanométrico de fósforo negro (en rojo). La imagen está ampliada 25.000 veces. (Foto: RMIT University),Nanotecnología médica,Fósforo negro para desgarrar microbios patógenos,https://noticiasdelaciencia.com/art/41652/fosforo-negro-para-desgarrar-microbios-patogenos
Redacción,,"Lunes, 03 de Mayo de 2021",https://noticiasdelaciencia.com/upload/images/05_2021/4150_primer-modelo-3d-de-la-la-distrofia-miotonica.jpg,Imagen de microscopía confocal de músculo in vitro desarrollado a partir de células de paciente en que se aprecia la tridimensionalidad del tejido. En azul se marcan los núcleos celulares y en rojo el músculo esquelético. (Imagen: IBEC),Medicina,Primer modelo 3D de la distrofia miotónica con células de pacientes,https://noticiasdelaciencia.com/art/41654/primer-modelo-3d-de-la-distrofia-miotonica-con-celulas-de-pacientes
Redacción,,"Martes, 04 de Mayo de 2021",,Noticias de la actualidad científica y tecnológica del 29 de abril de 2021.,Video,"Noticias de la Ciencia y la Tecnología, 29 de Abril de 2021",https://noticiasdelaciencia.com/art/41658/noticias-de-la-ciencia-y-la-tecnologia-29-de-abril-de-2021
Redacción,,"Martes, 04 de Mayo de 2021",https://noticiasdelaciencia.com/upload/images/05_2021/2348_el-eslabon-perdido-en-la-evolucion-temprana-del-reino-animal.jpg,Esta imagen realzada del fósil de Bicellum brasieri denota una pared exterior de células en forma de salchicha que encierra una masa celular interior. La estructura es claramente de tipo pluricelular. (Imagen: P.K. Strother),Biología,¿El eslabón perdido en la evolución temprana del reino animal?,https://noticiasdelaciencia.com/art/41656/el-eslabon-perdido-en-la-evolucion-temprana-del-reino-animal
Redacción,,"Martes, 04 de Mayo de 2021",https://noticiasdelaciencia.com/upload/images/05_2021/7709_como-veriamos-dos-agujeros-negros-supermasivos-atrayendose.jpg,"En este momento de la simulación, el agujero negro supermasivo de 200 millones de masas solares se encuentra en primer plano. Su gravedad distorsiona la luz del disco de acreción del otro agujero negro, menos masivo, situado casi directamente detrás de él, creando este panorama surrealista. Los diferentes colores de los discos de acreción facilitan la identificación de las contribuciones de cada uno. La luz azul corresponde al agujero negro de mayor masa y la rojiza al de menor masa. (Imagen: NASA's Goddard Space Flight Center / Jeremy Schnittman / Brian P. Powell)",Astrofísica,¿Cómo veríamos dos agujeros negros supermasivos atrayéndose mutuamente?,https://noticiasdelaciencia.com/art/41660/como-veriamos-dos-agujeros-negros-supermasivos-atrayendose-mutuamente
Redacción,,"Miércoles, 07 de Abril de 2021",,Noticias de la actualidad científica y tecnológica del 30 de marzo de 2021.,Video,"Noticias de la Ciencia y la Tecnología, 30 de Marzo de 2021",https://noticiasdelaciencia.com/art/41439/noticias-de-la-ciencia-y-la-tecnologia-30-de-marzo-de-2021
Redacción,,"Martes, 04 de Mayo de 2021",https://noticiasdelaciencia.com/upload/images/05_2021/617_los-vestigios-mas-antiguos-de-recoleccion-de-miel-en-africa.jpg,"Se han detectado restos de cera de abeja en vasijas de arcilla de 3500 años de antigüedad como esta. (Foto: Peter Breunig, Goethe University Frankfurt)",Arqueología,Los vestigios más antiguos de recolección de miel en África,https://noticiasdelaciencia.com/art/41662/los-vestigios-mas-antiguos-de-recoleccion-de-miel-en-africa
Redacción,,"Martes, 13 de Abril de 2021",,Noticias de la actualidad científica y tecnológica del 8 de abril de 2021.,Video,"Noticias de la Ciencia y la Tecnología, 8 de Abril de 2021",https://noticiasdelaciencia.com/art/41484/noticias-de-la-ciencia-y-la-tecnologia-8-de-abril-de-2021
Redacción,,"Martes, 04 de Mayo de 2021",https://noticiasdelaciencia.com/upload/images/05_2021/5149_el-impacto-humano-afecta-la-diversidad-de-plantas-de-las-islas-del-planeta.jpg,"Paisaje fragmentado de la Isla de Flores, Azores, Portugal. (Foto: Ana M. C. Santos)",Ecología,El impacto humano afecta la diversidad de plantas de las islas del planeta,https://noticiasdelaciencia.com/art/41664/el-impacto-humano-afecta-la-diversidad-de-plantas-de-las-islas-del-planeta
